{
  "applied_at": "2026-07-27T15:00:00Z",
  "authority": {
    "allowed_effects": [
      "challenge:resolve",
      "seed:supersede"
    ],
    "artifact_id": "sab_seed_fixture_first_verdict",
    "authority_refs": [
      "fixture:signed-policy"
    ],
    "content_sha256": "bbbbbbbbbbbbbbbbbbbbbbbbbbbbbbbbbbbbbbbbbbbbbbbbbbbbbbbbbbbbbbbb",
    "evaluated_state_hash": "aaaaaaaaaaaaaaaaaaaaaaaaaaaaaaaaaaaaaaaaaaaaaaaaaaaaaaaaaaaaaaaa",
    "evaluation_id": "sab_authority_fixture_live",
    "forbidden_effects": [],
    "live_eligible": true,
    "policy_sha256": "aaaaaaaaaaaaaaaaaaaaaaaaaaaaaaaaaaaaaaaaaaaaaaaaaaaaaaaaaaaaaaaa",
    "reason_codes": [
      "signed_policy_authorizes_exact_scope_and_effects"
    ],
    "result": "Authorized",
    "schema": "sab.disposition_authority.v1",
    "scope": "Live",
    "standing_effect": "none"
  },
  "effective_verdict_id": "sab_effective_fixture",
  "effects": [
    "challenge:resolve"
  ],
  "evidence_provenance": "real_external_models",
  "fixture_derived": false,
  "schema": "sab.effective_verdict.v1",
  "scope": "Live",
  "standing_effect": "none",
  "verdict_id": "sab_verdict_fixture",
  "verdict_sha256": "aaaaaaaaaaaaaaaaaaaaaaaaaaaaaaaaaaaaaaaaaaaaaaaaaaaaaaaaaaaaaaaa"
}
